{"$schema":"ai/schemas/gateway-result.schema.json","$id":"ai/gateway-result.json","schemaVersion":1,"operation":"PRE_COMMAND","result":"PASS","reason":null,"errors":[],"data":{"runId":"run-1","commandId":"verify.unit","attemptId":"attempt-1","argvHash":"aaaaaaaaaaaaaaaaaaaaaaaaaaaaaaaaaaaaaaaaaaaaaaaaaaaaaaaaaaaaaaaa","inputFingerprint":"bbbbbbbbbbbbbbbbbbbbbbbbbbbbbbbbbbbbbbbbbbbbbbbbbbbbbbbbbbbbbbbb","environmentFingerprint":"cccccccccccccccccccccccccccccccccccccccccccccccccccccccccccccccc","workingDirectory":".","argv":["./gradlew","test"]}}
